press_name,title,content
연합뉴스,"미군 수뇌부 또 조기교체…트럼프, 공군 참모총장 사실상 경질","(서울=연합뉴스) 고일환 기자 = 도널드 트럼프 미국 대통령 취임 이후 군 수뇌부의 조기 교체가 이어지고 있다.18일(현지시간) 워싱턴포스트(WP)에 따르면 공군은 이날 성명을 통해 데이비드 올빈 공군 참모총장이 오는 11월 초 퇴임할 계획이라고 밝혔다.조 바이든 행정부 때인 지난 2023년 임명된 올빈 참모총장은 임기 만료까지 2년이 남은 상태다.한 소식통은 올빈 참모총장의 퇴임은 피트 헤그세스 국방장관의 요청에 따른 것이라고 전했다.지난주 올빈 총장에게 사실상 경질을 통보했지만, '명예로운 퇴장'을 위해 스스로 조기 은퇴를 발표하는 형식으로 절충이 이뤄졌다는 것이다.트럼프 행정부는 중국발 안보 위기에 대해 공군의 대비가 부족하다는 점을 문제로 삼은 것으로 전해졌다.올빈 참모총장의 후임으로는 토머스 부시에 공군 부참모총장이 유력하다는 관측이 제기된다.부시에 부참모총장은 지난 6월 이란 핵시설에 대한 B-2 폭격기의 공습 작전을 지휘한 주요 인물 중 한명이다.미 공군 지구권타격사령부(AFGSC)를 이끌었던 그는 지난 7월 트럼프 대통령에 의해 공군 부참모총장으로 임명됐다.일각에선 트럼프 행정부의 군 수뇌부 교체가 너무 잦다는 지적도 제기된다.트럼프 대통령은 취임 직후인 지난 2월 찰스 브라운 합동참모본부 의장을 경질하고, 예비역 공군 중장 댄 케인을 차기 합참의장으로 지명했다.미국 역사상 두 번째 흑인 합참의장인 브라운 전 의장은 임기가 2년 8개월 가까이 남은 상태에서 교체됐다.또한 트럼프 대통령은 미국 최초의 여성 해군 참모총장인 리사 프란체티 제독과 함께 역시 해안경비대 사상 최초의 여성 사령관이었던 린다 페이건 제독도 해임했다.미군 수뇌부는 정권교체와 무관하게 정치적 중립을 유지하며 임기를 지키는 것이 통상적이라는 점을 감안한다면 이 같은 고위 장성의 경질은 군 내부의 안정성을 저해하는 요인이 될 수 있다는 지적도 제기된다.yonglae@yna.co.kr제보는 카카오톡 okjebo  <저작권자(c) 연합뉴스, 무단 전재-재배포, AI 학습 및 활용 금지>  2025/08/19 15:29 송고 2025년08월19일 15시29분 송고"
한국경제,"美 트럼프 무역장벽에 '도미노', 韓 직격탄…규제 철강 집중 [영상]","영상 모듈 닫기     미국이 수입 철강 제품에 50%의 품목 관세를 부과하는 등 보호무역주의를 강화한 후, 다른 나라에서도 신규 수입 규제가 이뤄졌고, 그중 절반이 철강 부문에 집중돼 대책 논의가 필요하다는 지적이다.18일 대한무역투자진흥공사(코트라)에 따르면 올해 상반기 한국산 제품에 대한 수입 규제는 총 218건으로, 작년 하반기(12월 말 기준)보다 2건 늘어났다. 이 가운데 신규 수입 규제는 9개 국가에서 10건이 새로 이뤄졌다. ADVERTISEMENT         특히 신규 수입 규제를 품목별로 보면 철강·금속이 5건으로 전체의 절반을 차지했다. 이어 화학(2건), 기타(2건), 플라스틱·고무(1건) 등의 순이었다.                         /사진=뉴스1                  남아프리카공화국이 한국산 알루미늄·아연 도금 평판 압연 제품에 대한 세이프가드 조사를 개시한 뒤 종료한 것을 비롯해 이집트가 한국산 열연 평판에 대한 세이프가드 조사를 시작했다. 영국은 한국산 열연 강판에 대해, 캐나다는 한국산 강철 결속재에 대해, 말레이시아는 한국산 아연 도금 강판에 대해 각각 반덤핑 조사를 시작했다.특히 트럼프 2기 행정부 들어 미국이 올해 3월부터 철강·알루미늄 제품 25%의 품목 관세를 부과하기 시작한 데 이어 6월부터 이 관세율을 50%로 올리는 등 무역 장벽을 높이면서 세계적으로 철강 제품에 대한 보호무역주의가 확산하고 있다고 보고서는 분석했다.이어 대만의 경우 미국의 철강 관세에 따른 밀어내기 수출 물량 우려로 철강제 구조물에 대한 수입 규제를 강화하고, 유럽연합(EU), 이집트, 말레이시아 등이 철강 제품에 대한 수입 규제를 강화할 것으로 전망했다. ADVERTISEMENT         미국은 상반기 기준 한국산 제품에 대해 총 54건의 수입 규제를 시행하고 있는 것으로 조사됐다. 이는 상반기 한국에 대한 전체 수입 규제 218건 중 25%에 해당해 가장 높은 비율을 차지한다. 반덤핑이 38건으로 가장 많았고, 상계관세 12건, 세이프가드 2건이며, 우회 수출과 관련한 조사도 2건 있었다.특히 미국은 올해 4월 16일 한국산 단량체 및 올리고머에 대한 반덤핑 조사에 새로 착수하는 등 규제의 끈을 놓지 않고 있는 것으로 나타났다. 특히 단량체·올리고머는 포장재 인쇄용 잉크, 목제 바닥재·전자부품 코팅, 광학 소재 접착제 등 분야에 폭넓게 사용되는데, 성장세가 두드러진 3차원(3D) 프린팅 산업과 차세대 전자재료 시장에서 수요가 빠르게 증가하고 있다.코트라는 ""미국은 작년 말부터 반덤핑 및 상계관세 제도 강화를 추진하고 국가안보를 명분으로 무역확장법 232조 활용, 불공정 무역 행위에 대응해 무역법 301조 가동 등 무역장벽을 높이고 있다""며 ""조사 중인 품목 및 예상 규제 품목을 대상으로 지속적인 모니터링이 필요하다""고 전했다.김소연 한경닷컴 기자 sue123@hankyung.com"
JTBC,트럼프 정부 '비자 취소' 벌써 4만…바이든 정부 2배,"[앵커]불법 이민자를 추방하겠다며 보너스까지 내 건 트럼프 정부가 올 들어 4만 명 넘는 사람들의 비자를 취소한 걸로 나타났습니다. 여기엔 유학생도 6000명이나 포함됐는데요. 시민권 심사에선 SNS를 검열하고, 도덕성 검증까지 하면서 노골적인 반이민 기조를 드러내고 있습니다.로스앤젤레스에서 홍지은 특파원입니다.[기자]미 국토안보부가 내건 이민·세관 단속 요원 모집 포스터입니다.트럼프 대통령을 배경으로 조국을 지키자며 지원할 것을 권유합니다.최대 연봉 1억 4천만원에 7천만원의 보너스와 학자금 대출 탕감까지 내걸었습니다.실제 트럼프 행정부는 이민자 단속에 열을 올리면서 올 들어 벌써 4만 명의 비자를 취소했습니다.같은 기간 바이든 행정부보다 두 배 이상 많습니다.비자가 취소된 대상에는 유학생 6000명도 포함됐습니다.대부분 폭행과 음주운전 때문이라는 설명이지만 최대 300명은 테러지원으로 취소됐습니다.팔레스타인 무장정파 하마스를 위한 모금을 했다는 이유인데 가자지구 공습 규탄 시위에 참여한 학생들이 대상이 됐습니다.[마코 루비오/미국 국무장관 (지난 5월) : 비자가 취소된 사례는 비자 조건을 위반했기 때문입니다. 학업을 중단했거나 범죄로 유죄 판결을 받았거나 형사 수사를 받고 있는 경우에 해당됩니다. 비자는 권리가 아니라 특권입니다.]트럼프 행정부는 비자에 이어 이민 문턱도 높이고 있습니다.지난 6월부터는 유학생 비자 심사과정에 SNS 계정 검열을 추가한 데 이어 최근 시민권 심사는 도덕성도 검증하기로 했습니다.단순히 범죄 기록만 확인하는 수준이 아니라, 납세 여부와 교육 수준까지 평가하는 겁니다.[도널드 트럼프/미국 대통령 (지난 5월) : 저는 외국인 유학생들이 미국을 사랑할 수 있는 사람인지 확인하고 싶습니다. 쇼핑몰이 폭발하는 일도, 미국인이 겪어야 했던 폭동도 원하지 않습니다.]국가 안보를 내세운 트럼프 행정부의 반이민 정책에 미국으로 향하는 문이 점점 좁아지고 있습니다.[화면출처 미국 국토안보부·이민국][영상편집 김영석 영상디자인 유정배 영상자막 홍수정]"
뉴시스,"""트럼프, 푸틴에게 양보하지 않았다""-WSJ 칼럼니스트","트럼프 아르메-아제르 평화 중재로 푸틴 압박미중 무역 협상으로 중국 대러 지원 위축 가능성   [앵커리지=AP/뉴시스] 도널드 트럼프(오른쪽) 미국 대통령과 블라디미르 푸틴 러시아 대통령이 15일(현지 시간) 미 알래스카주 앵커리지의 앨먼도프-리처드슨 합동군사기지에서 공동 기자회견하면서 악수하고 있다. 트럼프가 푸틴에게 양보한 것이 아니라는 주장이 제기됐다. 2025.08.119. [서울=뉴시스] 강영진 기자 = 도널드 트럼프 미 대통령의 대러시아 정책이 매우 복합적이며 블라디미르 푸틴 러시아 대통령이 우크라이나 전쟁 종식에 호응하기 시작한 것은 트럼프의 압박이 작용한 때문이라는 분석이 제기됐다.  미 월스트리저널(WSJ)의 객원 칼럼니스트인 월터 러셀 미드 미 허드슨 연구소 석좌연구원은 18일(현지시각) “트럼프의 눈부신 외교 정책(Trump’s Stunning Foreign Policy)”라는 제목의 칼럼에서 그같이 주장했다. 다음은 칼럼 요약.   지난 15일 미러 정상회담에 대해 많은 논평가들이 트럼프가 푸틴에게 비겁하게 양보했다며 격렬히 비난했다.   그러나 트럼프는 곧바로 백악관에서 볼로디미르 젤렌스크 우크라이나 대통령을 따듯하게 맞이했고 유럽 지도자들과 우정을 과시했다.   트럼프의 행보에 많은 사람들이 충격을 받았으나 놀랄 일이 아니다.   러시아와 미국의 관계는, 미국과 이스라엘의 관계처럼, 중요하지만 감정이 개입되면서 오해 받는 일이 잦다.  2차 세계 대전 당시 미국이 막대한 무기를 소련에 지원했던 시기를 제외하면 미국과 러시아는 서로에게 경제적으로 중요한 파트너가 아니었으며 양국 관계는 주로 지정학, 문화, 이데올로기에 좌우돼 왔다.   러시아가 알래스카를 미국에 팔았던 이유는 영국이 북미 식민지를 알래스카로 확대하는 것을 막으려는 의도에 따른 것이었다. 1,2차 세계 대전 동안에도 독일이 유럽을 지배하는 것을 막으려 미국과 러시아가 협력했다.   그러나 2차 세계 대전 뒤 냉전 시대에 미국은 소련이 유럽과 아시아를 지배하는 것을 막기 위해 소련에 맞섰다. closeAdvertisements[custom_chain] korean_weather [webstory]-20250820-00:08arrow_forward_ios더보기CANCELNEXT VIDEOPausePlay% buffered00:0000:0100:56UnmuteMutePlayPowered by GliaStudio 현재 미국에서는 유럽연합(EU)과 북대서양조약기구(NATO)를 위협하는 러시아가 미국의 안보도 위협한다는 견해가 주류다.   반면 러시아를 유럽에 대한 위협이라는 관점으로 보기보다 중국을 견제하는 잠재력을 가진 나라로 주목해야 한다는 주장도 소수 의견으로 제기되고 있다.    러시아에서는 푸틴의 비판자들이 미국 등 서방과 관계를 개선해야 중국이 제기하는 장기적 위험에 대처할 수 있다는 주장을 펴고 있다.   이처럼 미국과 러시아의 지정학적 관계는 극도로 복잡하다.   알래스카 정상회담을 두고 서방의 많은 평론가들이 트럼프가 푸틴에게 엄청난 양보를 했다고 비난한다.   푸틴은 그렇게 생각하지 않을 것이다.   최근 아르메니아-아제르바이잔 분쟁에 트럼프 정부가 개입해 평화 협정을 맺도록 중재하면서 소련 영토를 되찾으려는 푸틴의 전략이 직접적인 타격을 받았다.  두 나라의 합의는 중앙아시아의 석유와 가스가 서방 시장으로 수출되는 것을 막아온 러시아의 능력을 끝장낼 수 있는 잠재력이 있다.   나아가 중국이 갈수록 영향력을 확대하는 중앙아시아 에서 러시아의 입지를 약화시킬 우려마저 있다.   러시아는 또 트럼프 정부가 중국과 관계를 개선할 것인지 주시해야 하는 상황이다.   중국은 우크라이나 전쟁과 관련 러시아를 경제적으로 지원해왔다. 이제 푸틴은 경제난에 처한 중국이 미국과 관계 개선을 위해 러시아에 대한 지원을 축소할 것인지 신경 써야 한다.   트럼프는 유럽 동맹국들을 상대로 여러 번 자신의 의지를 관철했다.   그럼에도 유럽의 지도자들은 트럼프의 리더십을 과장되게 칭찬한다. 트럼프를 설득해 자신들 편에 서도록 하는 것만이 유럽에 도움이 된다는 것을 알기 때문이다.   트럼프가 프랑스 대통령을 ”에마뉘엘“이라는 이름으로 부르자 마크롱 대통령이 선생님의 호명에 답하는 학생처럼 ”대통령 각하“라고 답했다. 트럼프가 원하는 대로 해준 것이다. 트럼프가 유럽 지도자들을 길들이고 있음을 보여준다.   ◎공감언론 뉴시스 yjkang1@newsis.com"
채널A,트럼프 “우크라 안전 보장”…영토는 합의 못해,"[앵커]   뉴스A 시작합니다.    저는 동정민입니다.    길고 긴 터널의 끝이 보이는 것 같습니다.    무려 3년 6개월 동안 끌어오던 우크라이나 전쟁, 돌파구가 마련됐습니다.    푸틴 러시아 대통령을 만나고 온 트럼프 미 대통령, 오늘은 젤렌스키 우크라이나 대통령과 만났는데요.       푸틴, 젤렌스키, 트럼프 3자 회담 가능성을 강하게 내비쳤습니다.    전쟁 원인이었던 우크라이나의 나토 가입은 접는 대신, 나토처럼 미국이 우크라이나의 안전을 보장해주는 새로운 대안을 제시하면서 종전 논의가 급물살을 타고 있는데요.    어떤 조건으로 어떤 논의가 이뤄지고 있는지 조아라 특파원이 첫 소식으로 보도합니다.   [기자]   반 년 만에 백악관에서 다시 마주한 도널드 트럼프 미국 대통령과 볼로디미르 젤렌스키 우크라이나 대통령.    3년 6개월 째 이어지는 러시아 우크라이나 전쟁 종결을 위해 트럼프는 우선 유럽이 주도하되 미국이 공조하는 우크라이나 '안전 보장안'을 거론했습니다.    [도널드 트럼프 / 미국 대통령]    ""유럽에서 가장 큰 영향력을 가진 분들이 (우크라이나의) 보호를 원합니다. 우리가 도울 것입니다.""    러시아가 반대하는 우크라이나의 나토 가입 대신 '나토식 집단방위 5조'와 유사한 형태의 안전보장을 약속한 것입니다.   유럽 다국적 평화유지군이 배치될지 명확히 결정된 것은 아니지만 유럽 정상들은 환영의 뜻을 밝혔습니다.    나토 가입을 추진해왔던 젤렌스키도 일단 기대감을 드러냈습니다.    [볼로디미르 젤렌스키 / 우크라이나 대통령]    ""트럼프 대통령의 아이디어를 지지합니다.""    하지만 영토 문제는 합의점을 찾지 못했습니다.    앞서 푸틴은 천연자원이 풍부한 우크라이나 동부 산업지대인 '돈바스' 편입을 휴전의 조건으로 내건 가운데 젤렌스키는 이 문제를 푸틴과 직접 만나 논의하겠다고 밝힌 겁니다.   [볼로디미르 젤렌스키 / 우크라이나 대통령]    ""영토 문제는 저와 푸틴 대통령 사이에 남겨둘 사안입니다.""    이날 백악관 집무실에는 러시아군이 통제 중인 우크라이나 동부 지역이 표시된 지도가 놓여 있었는데, 이를 두고 우크라이나 압박용이라는 해석도 제기 됐습니다.    뉴욕타임스는 이번 회담을 두고 ""트럼프가 노벨평화상을 간절히 바라는 듯 했다""면서도 ""평화로 가는 진전은 구체적으로 드러나지 않았다""고 지적했습니다.    뉴욕에서 채널A뉴스 조아라입니다    영상취재: 김창종(VJ)    영상편집: 구혜정                                          •                조아라 기자              [likeit@ichannela.com]        •  [채널A 뉴스] 구독하기                                             Copyright Ⓒ 채널A. All rights reserved. 무단 전재, 재배포 및 AI학습 이용 금지"
뉴스1,"트럼프 ""우크라 안보보장에 美관여…푸틴도 동의, 큰 진전""(종합2보)","(워싱턴·서울=뉴스1) 류정민 특파원 이창규 기자 = 도널드 트럼프 미국 대통령이 18일(현지시간) 볼로디미르 젤렌스키 우크라이나 대통령과 만나 ""유럽이 우크라이나의 첫 번째 방어선이며, 미국도 우크라이나의 미래 안보 보장에 관여할 것""이라고 밝혔다.트럼프는 이어진 유럽 정상들이 합류한 다자 회담에서는 ""러시아가 우크라이나에 대한 안보 보장 방안을 수용하기로 동의한 것은 매우 중요한 단계""라면서 ""우리가 공동으로 우크라이나에 대한 미래의 공격을 억제할 수 있는 합의를 달성할 수 있을 것이라고 낙관한다""라고 말했다.이날 트럼프와 젤렌스키의 발언을 종합하면 나토 회원국 중 유럽의 주요 국가들이 우크라이나에 무기 공급뿐만 아니라 정보·훈련 등 다방면으로 군사력 강화를 지원하되, 미국은 패트리엇(미사일 요격 방공무기)을 포함해 양질의 무기 판매를 확대하는 방향으로 안보 보장의 큰 줄기를 잡았을 가능성이 높아 보인다.트럼프 대통령은 이날 워싱턴DC 백악관에서 열린 젤렌스키와의 정상회담에서 '우크라이나에 대한 안보 보장에 미군 병력이 포함될 수 있느냐'는 기자 질문에 ""오늘 오후 늦게 이에 대해서 알릴 것""이라면서 ""(유럽의) 위대한 국가들의 7명의 지도자와 회담을 가질 예정이며 그 문제에 대해 논의할 것""이라고 말했다.이어 트럼프는 ""그들이 유럽에 있기 때문에 첫 번째 방어선""이라면서 ""우리는 그들을 도울 것이며 관여할 것""이라고 덧붙였다.그는 ""평화가 달성된다면 그 평화가 장기적으로 유지되도록 보장할 것""이라면서 ""이는 매우 장기적인 문제이며, 2년간의 평화 후 다시 이 혼란에 빠지는 것을 논의하는 것이 아니다""라고도 했다.""우리는 지속 가능한 평화를 이룰 것""이라고 거듭 강조한 트럼프는 ""그 발표가 이루어지면 전 세계 사람들이 매우 기뻐할 것이라고 생각한다""라고 말했다.'러시아가 휴전에 동의하지 않는다면 심각한 후과가 있을 것으로 보느냐'는 질문에 트럼프는 자신의 두 번째 임기 들어 중재한 6개의 분쟁을 예로 들며 휴전 없이 평화협정을 맺은 것이라고 주장하면서, 러시아와도 평화협정을 맺을 것이라는 논리를 폈다.이날 젤렌스키는 ""미국으로부터 무기를 구매할 수 있는 가능성이 생겼다""면서 ""유럽이 나토(NATO, 북대서양조약기구) 프로그램을 통해 비용을 부담해 줘 감사드리며, 우리는 이 비용을 충당하기 위한 일부 프로그램을 보유하고 있다""라고 말했다.젤렌스키는 평화협정의 조건을 묻는 기자 질문에 대해 ""강력한 우크라이나 군대로 이는 제가 귀하의 동료들(미국)과 논의하기 시작한 내용""이라면서 ""무기, 인력, 훈련 임무, 정보 공유 등이 포함된다""라고 답했다.이어 ""우리는 파트너들과 논의할 것이며, 이에는 미국을 포함한 주요 국가들과 우리 친구들의 협력이 필요하다""라고 덧붙였다.트럼프 대통령은 ""저는 방금 푸틴 대통령과도 간접적으로 얘기했고, 오늘 회의가 끝나면 통화할 것""이라면서 ""3자 회담이 있을 수도 있고 없을 수도 있으며, 만약 3자 회담이 없다면 전투는 계속될 것""이라고 말했다.두 정상은 지난 2월 28일 백악관에서 가진 첫 회담에서는 전쟁 종식 방안과 러시아에 대한 인식 등을 두고 첨예한 입장 차이를 보이며 공개적으로 설전을 벌였고, 당시 젤렌스키는 예정됐던 오찬을 하지 않고 백악관을 쫓기듯 나서 귀국했었다.젤렌스키는 이전 회담 때 군복에 가까운 차림으로 백악관을 찾았던 것과 달리 이날은 넥타이는 매지 않았지만, 검은색의 재킷을 입고 회담에 참석했다.젤렌스키와의 약 1시간가량의 회담 후 트럼프는 에마뉘엘 마크롱 프랑스 대통령, 키어 스타머 영국 총리, 프리드리히 메르츠 독일 총리, 조르자 멜로니 이탈리아 총리, 알렉산데르 스투브 핀란드 대통령, 우르줄라 폰데어라이엔 유럽연합(EU) 집행위원장, 마르크 뤼터 나토 사무총장 등이 합류한 다자회담을 이어갔다.트럼프는 다자회담 모두 발언에서 ""러시아가 우크라이나에 대한 안보 보장을 수용하기로 한 것은 중요한 진전""이라면서 ""이는 우리가 고려해야 할 핵심 중 하나이며 테이블에서 논의할 사항""이라고 말했다.트럼프는 이어 ""유럽 국가들이 많은 부담을 지게 될 것이며, 우리는 그들을 돕고 매우 안전하게 만들 것""이라고 밝혔다.또 트럼프는 ""우리는 현재의 전선을 고려한 영토 교환 가능성에 대해 논의해야 한다""면서 ""이는 전쟁 지역, 전선으로 명확히 구분된 매우 슬픈 지역을 의미하며, 가능한 한 빨리 3자 회담을 시도할 것""이라고 말했다.트럼프는 ""푸틴도 해결책을 원한다. 조만간 1주일, 2주일이면 이를 해결할지 끔찍한 싸움을 계속할지 알게 될 것""이라며 ""궁극적으로는 젤렌스키 대통령과 우크라이나 국민이 푸틴 대통령과 대화해 결정해야 할 문제""라고 강조했다.젤렌스키는 ""안보 보장과 관련해 미국이 강력한 신호를 보내고 준비되어 있다는 점은 매우 중요하다""라고 말했다. 또 젤렌스키는 전쟁 포로, 납치 아동 송환도 매우 중요한 문제로 관련한 서한을 푸틴에게 보낸 멜라니아 트럼프 영부인에게 감사를 표했다.그러면서 젤렌스키는 ""가장 중요한 영토 문제 등 민감한 사안들을 3자 회담에서 논의할 것""이라고 덧붙였다.트럼프와 젤렌스키의 발언을 종합하면 유럽이 우크라이나에 대한 무기 및 군사력 강화를 지원하고, 미국이 패트리엇과 같은 방공 무기를 포함한 양질의 무기 판매를 확대하는 방향일 것으로 보인다. 여기에 트럼프가 언급한 지속적인 평화 유지 방안이 어떤 내용인지는 추후 공개되는 내용을 봐야 살펴봐야 한다.또 유럽 평화유지군 파병을 주도하고 있는 프랑스, 영국 등이 트럼프가 주도하는 안보 보장안에 찬성할지도 지켜봐야 한다.이날 마크롱 프랑스 대통령은 ""3자 회담의 의견이 매우 중요하고, 후속 조치로 4자 회담이 필요하다""면서 ""왜냐하면 안보 보장을 논의할 때는 유럽 대륙의 전체 안보를 논의하는 것이기 때문""이라고 강조했다.뤼터 나토 사무총장은 ""(미국이) 안보 보장에 참여할 의향이 있다고 말한 것은 큰 진전""이라면서 ""이는 진정한 돌파구이며 모든 차이를 만든다""라고 말했다.ryupd01@news1.kr"
