press_name,title,content
연합뉴스,젤렌스키-푸틴 '세기의담판' 벌어지나…전쟁종식 향한 중대 분수령,"(서울=연합뉴스) 장재은 기자 = 도널드 트럼프 미국 대통령이 추진하는 우크라이나 종전 계획이 러시아와 우크라이나 정상간 최후 담판 가능성으로 치닫고 있다.볼로디미르 젤렌스키 우크라이나 대통령과 블라디미르 푸틴 러시아 대통령이 얼굴을 맞대고 전쟁을 끝내도록 하겠다는 게 트럼프 대통령의 의지다.그러나 3년이 넘게 이어진 전쟁에서 찾을 수 없던 접점이 담판에서 이뤄질지가 의문인 데다 양국 정상회담이 성사될지조차 현재로서 더 지켜봐야 하는 상황이다.트럼프 대통령은 18일(현지시간) 백악관에서 젤렌스키 대통령, 유럽 정상들과 회의중 푸틴 대통령과 통화한 뒤 우크라이나와 러시아의 정상회담을 조율하기 시작했다고 밝혔다.그는 이들 전쟁 당사국의 정상회담 후 자신까지 포함한 3자 정상회담이 이어질 것이라고 계획을 밝히기도 했다.이 같은 계획은 트럼프 대통령이 지난 15일 푸틴 대통령, 이날 젤렌스키 대통령의 제안을 잇달아 청취한 뒤 내린 결단이다.트럼프 대통령 특유의 하향식(톱다운) 의사결정과 선이 굵은 협상·중재 방식이 드러나는 대목으로 빅딜 가능성에 대한 기대를 모은다.그러나 우크라이나와 러시아의 정상회담부터 과연 성사될지 의문이 제기된다.일단 러시아의 공식적인 반응이 적극적이지도 분명하지도 않다.유리 우샤코프 러시아 크렘린궁(대통령실) 외교정책 보좌관은 트럼프 대통령이 제시한 계획의 의미를 '아이디어' 수준으로 축소했다.그는 ""푸틴, 트럼프 대통령이 추가 전화통화에서 러시아와 우크라이나 대표단의 지속적 직접 협상에 지지를 표명했다""며 ""이런 의미에서 특히 대표단의 급을 올릴 가능성을 연구하는 게 필요하다는 아이디어가 논의됐다""고 말했다.러시아 정부는 상대의 제안을 거부할 때 직설적인 부정 대신 아이디어를 검토하겠다는 등의 불투명한 언변으로 일관하곤 했다.푸틴 대통령은 전쟁 내내 거듭된 젤렌스키 대통령의 요청에도 양자 정상회담을 거부해왔다.그는 우크라이나에 대한 침공전에서 젤렌스키 대통령을 척결해야 할 '나치 세력'의 우두머리로 간주해 정통성을 인정하지 않고 있다.푸틴 대통령이 말하는 나치는 러시아 안보를 위협하는 친서방 정권으로 그가 제시한 전쟁 목표는 우크라이나의 '탈나치화'이기도 하다.현재 러시아의 석연치 않은 태도를 고려하면 시간끌기가 지속될 가능성도 관측된다.러시아가 트럼프 대통령의 제안을 수용하는 것처럼 우크라이나와 고위급 직접 대화에 나서면서도 접점 없는 협상을 계속 되풀이할 수 있다는 전망이다.실제로 러시아는 트럼프 대통령의 지속적 휴전 압박에도 말로만 화답하는 모습을 보이며 침공전을 지속해왔다.여기에는 현재 전황을 보면 불리할 게 없으며 시간이 자신들의 편이라는 계산이 깔려있다.우크라이나는 장기 소모전에 따른 병력과 장비 손실, 국민들과 서방국들의 커가는 전쟁 피로도 때문에 점점 힘이 빠져가고 있다.그 반면 러시아는 북한을 비롯한 전략적 파트너들에서 병력과 무기를 지원받아 점령지 확대에 속도를 내고 있다.다만 일부에서는 협상 성사 가능성에 대한 백악관 회의 참석자의 발언에서 푸틴 대통령이 회담에 동의했다는 얘기가 나오기도 했다.프리드리히 메르츠 독일 총리는 푸틴 대통령이 2주 안에 젤렌스키 대통령과 양자회담을 여는 방안에 동의했다고 말했다고 AFP통신이 전했다.AP 통신은 트럼프 대통령이 푸틴 대통령과의 전화통화에서 ""러시아와 우크라이나의 회동이 2주 내에 있을 것이라는 데 뜻을 같이했다""고 보도했다.푸틴 대통령이 실제로 계획에 찬성했는지, 트럼프 대통령이 자신의 희망사항을 피력한 것인지 불확실한 상황이다.트럼프 대통령의 의지에 따라 미국과 전쟁 당사국들의 정상회담이 열린다고 하더라도 합의가 도출될지는 미지수다.우크라이나와 러시아에서 서로 받아들일 수 없고 현재로서 타협이 전혀 이뤄지지 않은 것으로 관측되는 난제가 많기 때문이다.트럼프 대통령의 중재안에는 기본적으로 우크라이나의 일부 영토 포기가 담긴 것으로 확인된다.푸틴 대통령은 종전의 핵심 조건으로 친러시아 주민이 많이 거주하는 우크라이나 동부 돈바스(도네츠크주와 루한스크주)에 대한 양보를 제시하고 있다.우크라이나는 전쟁 초기에 루한스크주를 완전히 내준 뒤 도네츠크주 중서부에 방어선을 세워 돈바스에 대한 완전 점령을 막고 있다.로이터 통신의 오픈소스 지도 분석에 따르면 러시아는 돈바스 지역의 88%인 4만6천570㎢를 점령하고 있다. 루한스크는 거의 전부, 도네츠크는 75%를 장악했다.안보 전문가들은 러시아가 우크라이나에 대한 추가 침공의 발판을 마련하기 위해 도네츠크에서 우크라이나군의 철수를 요구한다고 의심한다.도네츠크에는 우크라이나가 동부 분쟁이 시작된 이후 11년 동안 공을 들여온 요새 도시들이 이른바 '요새 벨트'를 형성하고 있다.우크라이나의 도네츠크 철군은 푸틴 대통령이 언제라도 쉽게 지상군 재침공을 결단할 수 있도록 할 전술적 이점을 안길 것이라는 얘기다.그뿐만 아니라 영토에 대한 타협은 젤렌스키 대통령에게 정치적 치명타가 될 가능성이 크다.우크라이나 헌법은 영토를 양도하지 못하도록 할 뿐만 아니라 우크라이나 국민도 영토 양보에 극도로 민감한 정서를 지니고 있다.젤렌스키 대통령은 트럼프 대통령에게 종전의 핵심 조건으로 자국에 대한 안보 보장을 요구하고 있다.서방이 제공할 안보 보장의 방식에는 북대서양조약기구(나토·NATO) 가입, 유럽의 주둔이나 군사지원 등이 있다.푸틴 대통령은 우크라이나의 안보보장 요구, 특히 나토 가입은 논의 시작조차 용납하지 못할 금기로 못을 박고 있다.그는 서방의 동쪽 세력확장을 우크라이나에서 군사작전을 시작한 근본 원인으로 강조하고 있다.푸틴 대통령의 우크라이나전 양대 목표는 우크라이나의 탈나치화(친서방 정권 제거)와 탈군사화(외국군 배제를 비롯한 우크라이나의 무장해제)로 공표돼 있다.다만 트럼프 대통령은 푸틴 대통령이 안전보장에 대해 양해했다는 취지로 언급하고 있는 만큼 정치적으로 절충이 이뤄질 가능성은 지켜볼 일이다.푸틴 대통령은 우크라이나전의 즉각적 종식을 천명하며 출범한 트럼프 행정부의 거듭된 종전 압박에 시간끌기로 일관해왔다.전쟁 당사국들에 대한 직접 대화를 토대로 트럼프 대통령이 제시한 양자, 3자 정상회담이 푸틴 대통령의 진의를 확인할 '진실의 문'이 될지 국제사회의 시선이 쏟아진다.jangje@yna.co.kr제보는 카카오톡 okjebo  <저작권자(c) 연합뉴스, 무단 전재-재배포, AI 학습 및 활용 금지>  2025/08/19 10:42 송고 2025년08월19일 10시42분 송고"
채널A,"트럼프 압박에…비만약값 ‘美 70% 인하, 英 170% 인상’","일라이 릴리 마운자로와 젭바운드 (사진=일라이 릴리 홈페이지) 도널드 트럼프 미국 대통령이 자국 의약품 가격 인하를 위해 글로벌 제약사를 압박하는 가운데, 비만치료제 ‘마운자로’ 제약사인 일라이릴리가 미국 외 국가에서 약가를 인상하기로 했습니다.   관련 업계에 따르면 일라이릴리는 현지시간 14일 성명서를 내고 다음달부터 일부 국가들의 의약품 가격을 조정하겠다고 발표했습니다.   Video Player is loading.PauseNextUnmuteCurrent Time 0:00/Duration 1:37Loaded: 4.12%0:00Stream Type LIVESeek to live, currently behind liveLIVERemaining Time -1:37 1xPlayback RateChaptersChaptersDescriptionsdescriptions off, selectedSubtitlessubtitles settings, opens subtitles settings dialogsubtitles off, selectedAudio TrackLadin, selectedFullscreenThis is a modal window.Beginning of dialog window. Escape will cancel and close the window.TextColorWhiteBlackRedGreenBlueYellowMagentaCyanTransparencyOpaqueSemi-TransparentBackgroundColorBlackWhiteRedGreenBlueYellowMagentaCyanTransparencyOpaqueSemi-TransparentTransparentWindowColorBlackWhiteRedGreenBlueYellowMagentaCyanTransparencyTransparentSemi-TransparentOpaqueFont Size50%75%100%125%150%175%200%300%400%Text Edge StyleNoneRaisedDepressedUniformDropshadowFont FamilyProportional Sans-SerifMonospace Sans-SerifProportional SerifMonospace SerifCasualScriptSmall CapsReset restore all settings to the default valuesDoneClose Modal DialogEnd of dialog window.Backward Skip 10sPlay VideoPause VideoForward Skip 10s    일라이릴리는 ""미국 행정부의 선진국 간 의약품 연구 비용을 공정하게 분담하겠다는 목표를 지지한다""며 ""미국 내 의약품 가격을 낮추기 위해서 유럽과 같은 다른 선진국 시장에서 정부와 의료 시스템이 지불하는 의약품 가격을 인상해야 한다""고 전했습니다.   파이낸셜타임스 등 외신에 밝힌 바에 의하면 일라이릴리의 비만치료제 '마운자로'(터제파타이드)는 영국에서 최대 170% 인상됩니다. 다만 릴리는 영국 국민건강보험(NHS) 환자들의 접근성은 유지한다고 밝혔습니다.   반면 미국에서는 환자 비용을 낮추기 위한 조치를 취했습니다. 소비자에게 직접 처방약을 판매하는 '릴리 다이렉트'를 확대해 젭바운드(마운자로 미국 제품명) 등 릴리 의약품 접근성을 높였습니다. 인슐린 가격은 70% 인하하고 환자 본인부담금을 월 35달러로 상한 설정한 겁니다.   일라이릴리의 이번 조치는 트럼프 행정부의 압박에 대한 글로벌 제약사의 첫 대응 사례입니다. 미국 내 약가 인하를 방어하기 위해 미국 외 국가들의 가격을 올려버리는 방식을 취한 것입니다.    트럼프 행정부는 그간 미국의 높은 의약품 가격을 낮추겠다며 다양한 제도를 추진하고, 높은 관세 적용을 예고해 글로벌 제약산업 전반을 압박해 왔습니다.   트럼프 대통령은 최근 글로벌 제약사 17곳에 내달 29일까지 미국 내 약값을 내리라고 통보하기도 했습니다. 이들 기업의 미국 내 약가가 다른 나라보다 2~3배 비싸다며, 다른 선진국에 부과하는 약품 가격의 최저 수준으로 내리라는 내용의 공개서한을 보냈습니다. 트럼프 대통령은 또 해외에서 들여오는 의약품에 대한 품목 관세를 최대 250%까지 매기겠다고 예고한 바 있습니다.   일라이릴리는 ""선진국들이 약가를 공정하게 분담해야 한다는 데에 동의하지만, 높은 약가를 초래하는 미국의 근본적이고 구조적인 문제도 해결해야 한다""고 강조했습니다.   다른 선진국들에 비해 미국의 약가 체계가 복잡하고 불투명하며 교차 보조금, 정부 프로그램 남용, 환자의 보험 부담금 등이 존재한다고 지적한 겁니다.    일라이릴리는 미 행정부의 관세 압박과 관련해선 ""의약품은 생명을 구하는 특성으로 오랫동안 관세 대상에서 제외돼 왔다""며 ""광범위한 의약품 관세는 비용을 증가시키고 환자 접근을 제한하며, 미국 내 제조에 대규모 투자를 진행 중인 기업들의 경우 미국의 리더십을 약화시킬 것""이라고 경고했습니다.   대신 미국의 제조 및 공급망 회복력을 강화하는 전략적 인센티브를 우선시할 것을 촉구했습니다.                                          •                홍성규 기자              [hot@ichannela.com]        •  [채널A 뉴스] 구독하기                                             Copyright Ⓒ 채널A. All rights reserved. 무단 전재, 재배포 및 AI학습 이용 금지"
TV조선,주미 대사에 트럼프 최소 4차례 만난 '文 외교장관' 강경화…주일대사엔 이혁,"[앵커]이재명 대통령이 한일, 한미 정상회담을 앞두고 양국 대사를 각각 내정했습니다. 관심을 모았던 주미대사에 문재인 정부때 외교부장관을 지낸 강경화 전 장관이 발탁됐는데,, 트럼프 1기 시절 트럼프 대통령과 여러 차례 만났던 인연을 고려한 것으로 전해졌습니다.신경희 기자가 보도합니다.[리포트]지난 2017년 한국을 국빈 방문한 트럼프 미국 대통령을 강경화 당시 외교부 장관이 가장 먼저 맞습니다.문재인 정부 첫 외교수장이었던 강 전 장관은 2018년과 2019년 워싱턴과 서울에서 번갈아 열렸던 한미 정상회담과 기자회견에 배석했습니다.최근 '한미동맹 현대화' 논의와 맞물려 다시 언급되는 2019년 방위비분담금 협상의 당사자기도 합니다.강경화 / 前 외교부장관 (2019년 2월)""총액 등에 있어 차이를 좁힌 것은 그동안 한국과 미국이 쌓은 선의와 신뢰 덕분이라고 생각합니다.""      전 정권 외교장관을 대사에 내정하는 건 다소 이례적이란 평가도 나오지만 트럼프 행정부를 상대로 외교를 조율했던 경험이 발탁 배경 중 하나인 것으로 알려졌습니다.현재 아시아소사이어티 회장을 맡아 뉴욕에 체류 중인 강 전 장관은 조현 외교부장관과 연세대 정치외교학과 동문이기도 합니다.하상응 / 서강대학교 정치외교학과 교수""안전한 선택 아닌가요? 꽤 익숙한, 그리고 지금 미국에 근거를 두고 있는 기관에서 일을 하고 계시니까.""주일본 대사엔 이혁 전 주베트남 대사가 내정됐습니다. 위성락 국가안보실장과 외무고시 동기로, 주일본공사 등을 지낸 '일본통'으로 꼽힙니다.미일 대사 내정자에 대해선 현재 주재국 동의 절차인 '아그레망'이 진행되고 있는데, 대통령 순방 전 완료될지는 미지수입니다.TV조선 신경희입니다."
매일경제,이대통령 ‘트럼프가 만족할 선물’ 챙긴다…4대 그룹에서만 126조 ‘투자 보따리’,"이재명 대통령과 재계 총수들이 19일 용산 대통령실에서 간담회를 갖고 한미 정상회담에 앞서 ‘원팀 코리아’ 전략을 논의했다.정부간 관세협상은 큰 틀에서 마무리됐기 때문에 가장 큰 관심사는 방미 기간 중 발표될 한국 주요 기업들의 미국 내 직접투자 규모다.협상 성과를 과시하고 싶어하는 도널드 트럼프 미국 대통령에게 추가로 ‘투자 선물’을 안겨야 한미 정상회담을 성공적으로 마무리할 수 있다는 공통된 인식도 깔려 있다.이날 간담회에선 개별 기업의 직접 투자와 관련한 논의도 오갔다. 대통령실 핵심 관계자는 “구체적인 숫자가 거론되지는 않았다”면서도 “대통령이 기업들에게 대미 투자 부분도 잘 챙겨달라는 취지로 당부했다”고 전했다.대미 투자 확대를 미국이 거세게 압박하면서 국내 산업의 공동화 우려가 커진 것도 사실이다. 이날 이재용 삼성전자 회장은 이같은 염려를 의식한 듯 “대미 투자와 별개로 국내에서도 지속해서 양질의 일자리를 창출하고 고부가가치 산업을 육성할 수 있도록 관련 투자를 지속하겠다”고 강조했다.이 대통령의 방미 일정에는 이재용 삼성전자 회장, 최태원 SK 회장, 정의선 현대차 회장, 구광모 LG 회장, 김동관 한화 부회장, 조원태 한진 회장, 구자은 LS 회장 등이 동행할 것으로 알려졌다. 강유정 대통령실 대변인은 브리핑에서 “미국 방문 경제인단은 15개사로 구성돼 있다”면서 “조선, 항공, 반도체, 배터리, 자동차, 에너지, 핵심 광물 등 다양한 기업들”이라고 밝혔다.앞서 트럼프 대통령은 지난달 31일 한미 관세협상 타결 직후 트루스소셜에 “한국은 그들의 투자 목적으로 거액을 투자하기로 합의했다”며 “총액은 향후 이재명 한국 대통령이 양자회담을 위해 백악관에 올 때 발표될 것”이라고 주장했다.트럼프 대통령이 언급한 ‘거액의 투자’는 한국 정부가 관세협상에서 합의한 3500억달러 규모의 대미 투자펀드 조성과 1000억달러 규모의 미국산 에너지 구매와는 별개다. 한국 기업들의 미국 내 직접투자(그린필드 투자)를 가리킨다.또 다른 대통령실 핵심 관계자는 “신규 투자 발표는 물론 기존 알려진 투자라도 트럼프 대통령 임기 중 이뤄지는 것은 다 포함해서 발표하게 될 것”이라고 전했다.이를 감안해 대미 직접투자 규모를 기업별로 살펴보면 삼성전자·SK그룹·현대차그룹·LG그룹 등 4대 그룹만 대략 126조원 규모로 추산된다.삼성전자는 미국 텍사스주 테일러시에 370억달러(51조6000억원)를 투자해 파운드리 공장과 연구개발(R&D) 시설을 짓고 있다. 이번 방미를 통해 투자 규모를 더 확대해서 발표할 수 있다.또 미국내 반도체 생태계 재구축이 트럼프 행정부의 큰 목표이기 때문에 관련된 투자나 파트너십이 발표될 가능성도 있다. 삼성전자는 미국 사우스캐롤라이나주에서 세탁기 공장을 운영하고 있는데 이 시설에 추가 투자가 이뤄질지도 관심이다. 삼성그룹이 바이오 산업을 새로운 먹거리로 키우고 있는 만큼 이 분야에서 깜짝 투자를 발표하는 시나리오도 거론된다.SK그룹은 2028년까지 130억달러(18조원) 추가 투자를 목표로 삼고 있다. SK하이닉스의 경우 38억7000만달러(5조원)를 들여 인디애나주에 고대역폭메모리(HBM) 패키징 공장을 건설하고 있다. 여기에 SK온이 미국 완성차 회사들과 함께 배터리 합작공장에 투자할 방침이다.현대차그룹은 2028년까지 미국에 210억달러(약 29조원)를 투자하겠다고 밝힌 바 있다. 자동차와 부품·물류·철강 그리고 미래산업·에너지 부문에 투자한다. 자동차 부문에서는 미국 현지생산 120만대 체제 구축을 위해 총 86억달러(12조원)를 투자해 기아와 제네시스 생산 라인까지 추가로 설치한다.또 계열사인 현대제철은 루이지애나주에 270만t 규모의 전기로 제철소를 건설한다. 58억달러(8조원) 규모 투자다.LG그룹에서는 LG에너지솔루션은 미국 내 생산 기지를 확장하며 현지 투자를 늘려가고 있다. 오하이오, 미시간, 테네시 등에서 합작 공장을 운영하거나 건설하는 방식이다. 이를 두고 통상 환경을 유리하게 만드는 데 중요한 협상 수단이 될 수 있단 분석이 나온다. 아울러 LG화학이 테네시에 북미 최대 규모의 양극재 공장을 건설 중이어서, 배터리 밸류체인 구축을 위한 추가 투자도 뒤따를 것이란 전망이다.포스코인터내셔널은 북미산 LNG를 대규모로 확보해둔 상황이다. 지난해 8월 멕시코퍼시픽과 연간 70만t 규모 북미산 LNG 장기 도입 계약을 체결했다. 2022년에는 세니에르와 연간 40만t LNG 공급 계약도 성공적으로 끌어내며 20년간 매년 110만t의 북미산 LNG를 안정적으로 확보하는 기반을 마련했다.알래스카 LNG 프로젝트 참여 역시 대미 외교에서 중요한 전략적 자산 역할을 할 것이란 관측이 나온다. 포스코인터내셔널, SK E&S, GS칼텍스, 세아제강 등 국내 주요 에너지 기업들의 참여 가능성이 거론되는 가운데 실제 참여가 확정될 경우 한국 정부가 미국에 제시할 수 있는 효과적인 협상 수단이 될 것이라는 분석이다.글로벌 최고 수준의 조선업체를 보유한 그룹들 역시 미국 투자를 단행할 것으로 예상된다. HD현대와 한화는 조선업 재건에 목마른 미국과 협력을 통해 MASGA(미국 조선업을 다시 위대하게) 프로젝트를 구체화하는 과정에서 미국 내 조선시설 재건, 인력 교육, 공급망 정비 등에 투자할 가능성이 높다.대한항공은 2033년까지 미국 항공기와 엔진 구입을 늘려가고 있다. 보잉 777-9 20대와 보잉 787-10 20대를 도입하고 앞으로 비슷한 조건으로 항공기 10대를 추가 도입할 계획이다. 거래규모는 249억달러에 이른다. 또 GE에어로스페이스의 예비 엔진 8대 도입과 엔진 정비 서비스 분야에서 협력하기로 했다.LS그룹 계열사 LS전선은 지난 4월 미국 버지니아 주에 미국 최대 규모의 해저케이블 공장 착공식을 가졌다. 투자 규모는 6억8100만달러(1조원)다. 트럼프 2기 행정부 들어 가장 처음 실행된 대규모 현지 투자인 해저케이블 공장은 연면적 7만㎡ 규모로 2028년 1분기 양산을 목표로 한다.두산에너빌리티는 미국 웨스팅하우스와 계약을 맺고 사우스캐롤라이나주 서머 원전과 조지아주 보글 원전에 원자로 용기, 증기 발생기 등 주기기를 공급했고 최근에는 소형모듈원전(SMR) 개발을 위해 미국 설계업체인 뉴스케일파워와 1억1000만달러 규모의 협력을 진행 중이다."
부산일보,트럼프 대좌 전 재계와 ‘원팀’ 전열 정비한 이 대통령,"이 대통령 방미·방일 기업인 간담회""기업인들 애 많이 써 관세 협상 성과""트럼프 대면 전 '재계 원팀' 공고주미·주일 대사 조만간 인선…외교 라인 정비이재명 대통령이 한미 정상회담을 앞두고 방미 동행 기업인들과의 간담회를 갖고 재계 ‘원팀’ 체제를 공고히했다. 최근 주미대사에 강경화 전 외교부 장관을 내정하기도 하는 등 트럼프 대통령과의 대면 전 외교 라인도 가다듬는 모양새다.이 대통령은 19일 오전 용산 대통령실에서 미국과 일본 순방에 동행하는 경제단체·기업인 간담회를 가졌다. 이 대통령은 이날 간담회에서 “(미국과의) 관세협상 과정에서 우리 기업인들이 애를 많이 써줘서 생각보다 좋은 성과를 냈다”며 기업인들에게 감사의 뜻을 표했다.대통령실 강유정 대변인은 이 대통령이 특히 “이번 미국 방문에 동행하는 기업인들이 현장에서 실질적인 성과를 많이 만들어달라”고 당부했다고 전했다. 그러면서 이 대통령은 “정부의 최대 목표는 경제를 살리고 지속성장의 토대를 마련하는 것에 있다”며 “수출 여건의 변화로 정부와 기업 모두 어려움을 겪고 있지만, 함께 힘을 모아 위기를 기회로 만들자”고 강조했다.이날 간담회에서 이 대통령은 기업들의 대미 투자 계획과 관세 등에 따른 애로사항 등을 들었다. 간담회에는 최태원 대한상공회의소 회장과 류진 한국경제인협회장을 비롯해 이재용 삼성전자 회장, 구광모 LG그룹 회장 등 재계 총수들이 참석했다. 조원태 한진그룹 회장, 김동관 한화그룹 부회장, 장재훈 현대차그룹 부회장, 박지원 두산에너빌리티 회장, 서정진 셀트리온그룹 회장 등도 자리했다.이 대통령은 한미 정상회담을 앞두고 조만간 외교 라인 정비 차원에서 주미·주일대사 인선을 단행할 것으로 보인다. 주미대사로는 강경화 전 외교부 장관이 내정 단계인 것으로 전해진다. 주일대사로는 이혁 전 주베트남 대사가 내정된 것으로 알려졌다. 강 전 장관은 주UN 대표부 공사와 유엔 사무총장 정책특별보좌관 등으로 외교무대에서 활동하다가 문재인 정부 초대 외교부 장관을 지낸 바 있다. 이 전 대사는 외교통상부 아시아태평양국장과 기획조정실장 등을 거쳤고 2009년 주일본 공사를 거치며 현지 경험을 쌓은 바 있다. 조현 외교부 장관은 전날 국회 외교통일위원회에 출석해 주변 4강 대사 중 아그레망(외교사절에 대한 주재국의 동의) 절차가 진행 중인 곳이 있느냐는 질문에 “일부 있다”고 밝혔다.한편, 강훈식 대통령비서실장은 이날 기자간담회를 통해 청와대 연내 이전 계획과 함께 조만간 부동산 대책을 발표할 예정이라고 밝혔다.곽진석 기자 kwak@busan.com"
