press_name,title,content
한국경제,"손정의, 3조 파격 베팅한 곳이…""삼성·SK에 악재"" 초긴장","사진=로이터연합뉴스                  도널드 트럼프 미국 정부가 자국의 반도체 기업 인텔의 지분 10%를 취득하는 방안을 논의 중인 가운데, 손정의 회장이 이끄는 일본 소프트뱅크그룹이 먼저 인텔에 20억달러(약 2조8000억원)를 투자했다. 경영난에 빠진 인텔이 대규모 투자를 발판으로 부활할 수 있을지 시장의 관심이 쏠리고 있다. 미 정부의 이번 결정이 삼성전자 SK하이닉스 등 국내 반도체 업계에 악재가 될 것이란 해석도 나온다. ADVERTISEMENT     인텔 부활에 베팅한 손정의블룸버그 통신은 18일(현지시간) 트럼프 행정부가 인텔의 지분을 10% 취득하는 방안을 논의 중이라고 보도했다. 소식통은 연방 정부가 반도체법에 따라 인텔에 제공한 보조금의 일부나 전부를 지분 투자 형태로 전환하는 방안을 검토하고 있다고 말했다.이날 기준 인텔의 시가총액은 1036억달러(약 144조원)다. 보도대로라면 미국 정부는 약 100억달러(약 13조9000억원)를 투자하는 셈이다. 이 소식이 전해지고 몇시간 지나지 않아 인텔 최고경영자(CEO) 립부 탄은 소프트뱅크가 20억달러를 투자, 지분 2%를 인수할 것이라고 공식 발표했다. 탄 CEO는 ""손 회장과 나는 수십 년 동안 긴밀히 협력해 왔다""며 ""이번 투자는 그가 인텔 부활에 신임투표를 한 것""이라고 말했다.손 회장이 이번 투자를 전격 결정한 것은 미국 정부의 지분 인수로 인텔이 무너질 일은 없다고 판단했기 때문이라고 블룸버그는 분석했다. 미·일 무역 협상 타결 당시 일본이 미국에 5500억달러를 투자하기로 약속한 것의 일환이라는 해석도 내놨다. 손 회장은 이날 성명을 통해 ""인텔은 50년 넘게 혁신을 주도한 신뢰할 수 있는 리더였다""며 ""이번 전략적 투자는 인텔의 첨단 반도체 제조 및 공급이 확대될 것이라는 우리의 확신을 반영한다""고 밝혔다.                         사진=연합뉴스                  인텔은 투자금을 오하이오주에 건설 중인 파운드리(반도체 위탁생산) 공장 건설에 우선 투입할 계획으로 알려졌다. 2022년 착공한 오하이오 공장은 올해 완공될 예정이었지만 인텔이 경영난에 빠지면서 2030년으로 완공 시점이 미뤄졌다. 로이터통신은 오하이오 공장 완공이 미국 내 제조업 일자리를 늘리려는 트럼프 행정부 의도와도 부합한다고 전했다. ADVERTISEMENT          삼성전자 TSMC엔 악재될 수도트럼프 행정부가 인텔 살리기에 나선 것은 국가 안보와 직결된 전략 자산인 반도체 공급망을 자국 중심으로 재편하려는 '미국 우선주의' 일환이다. 트럼프 정부는 앞서 US스틸, MP머티리얼즈, 엔비디아, 보잉 등의 기업을 다룰 때도 훨씬 적극적으로 개입했는데, 이번 '인텔 부분 국유화'는 거기서도 한 발 더 나아간 시도다. 월스트리트저널은 “트럼프 대통령이 자본주의 나라 미국을 점차 국가자본주의로 탈바꿈시키고 있다”고 분석했다.이번 조치가 실행되면 미 정부는 인텔의 최대주주가 된다. 미 정부가 인텔을 국영기업처럼 운영하면 미국 내 반도체 사업을 영위하는 한국 삼성전자 SK하이닉스, 대만 TSMC 등에 악재가 될 수 있다. 파운드리 시장의 주 고객사인 빅테크 기업들이 트럼프 행정부의 압박에 눌려 발주 물량을 인텔에 몰아줄 수 있기 때문이다.                                           미 정부와 소프트뱅크의 대규모 투자에도 불구하고 월가의 분위기는 아직 싸늘하다. 엔비디아 AMD 삼성전자 TSMC 등에 비해 근본적인 기술 경쟁력 저하 우려가 여전하기 때문이다. 이날 블룸버그 보도가 장중 전해졌지만 인텔의 주가는 3.66% 급락한 채 마감했다. 소프트뱅크의 투자 결정소식 이후 시간 외에선 5.41% 올랐다.투자은행(IB) 번스타인은 ""트럼프가 인텔을 다시 위대하게 만들수 있을지는 지켜봐야 한다""며 ""인텔의 문제는 돈이 아니라 혁신의 부재에 있다""고 지적했다. 이어 ""정부가 인텔에 어떤 반대급부를 요구할지 모른다는 불확실성도 있다""고 덧붙였다. 미즈호의 조던 클라인 매니징디렉터도 ""큰손 투자자들이 인텔에 대한 쇼트(공매도) 포지션을 정리하느라 최근 단기적으로 주가가 올랐지만 근본적인 경쟁력이 개선될 수 있을지에 대한 확신은 없는 상태""라고 전했다. ADVERTISEMENT         번스타인은 인텔의 목표주가를 이날 종가(23.66달러)보다 낮은 21달러로 낮췄다. JP모간도 목표주가 21달러, 투자의견 '매도'를 제시했다. 최만수 기자 bebop@hankyung.com"
연합뉴스,"[속보] 백악관 ""트럼프, 안보팀에 유럽과 '우크라 안보보장' 협조 지시""","제보는 카카오톡 okjebo  <저작권자(c) 연합뉴스, 무단 전재-재배포, AI 학습 및 활용 금지>  2025/08/20 02:25 송고 2025년08월20일 02시25분 송고"
미디어오늘,"‘친트럼프’ 방송, 부정선거 음모론 대가로 931억 원 배상","▲도널드 트럼프(Donald Trump) 미국 대통령. 사진=flickr             2020년 미국 대통령선거 당시 부정선거 음모론을 제기해 손해배상 소송을 당한 보수성향 미국 케이블방송 뉴스맥스가 931억 원의 합의금을 내기로 한 것으로 나타났다. 2020년 대선 부정선거 음모론 보도와 관련된 손해배상 소송이 막바지 단계다. 뉴스맥스는 지난 18일(이하 현지시간) 부정선거 음모론 관련 명예훼손 종결을 위해 전자투표 업체 도미니언에 6700만 달러(931억6350만 원)의 합의금을 지급하기로 했다고 밝혔다. 합의금은 2027년 1월까지 세 차례에 걸쳐 지급된다. 뉴스맥스는 오랜 기간 도널드 트럼프 미국 대통령을 지지해 온 친트럼프 성향 매체다. 뉴스맥스는 성명에서 “(손해배상이라는) 문제가 해결됨에 따라 정확한 보도와 활발한 토론, 다양한 관점 제공이라는 사명을 계속 수행할 수 있게 됐다”며 “이번 합의를 통해 명확성과 새로운 집중력을 바탕으로 사업을 추진할 수 있을 것”이라고 밝혔다. 뉴스맥스가 손해배상 청구액인 16억 달러(한화 약 2조2248억 원)에 한 참 못 미치는 금액으로 합의를 맺으면서 지난 18일 뉴스맥스 주가는 15.03% 급등했다. 뉴스맥스는 2020년 대선에서 도미니언이 투표 시스템을 조작했다고 주장했다. 2020년 대선 당시 28개 주가 도미니언이 제작한 투표기를 사용했는데, 뉴스맥스는 도미니언이 트럼프 당시 대선후보 낙선을 위해 베네수엘라에 있는 기업과 함께 투표 결과를 조작했다고 보도했다. 뉴스맥스가 2021년까지 18차례 부정선거 음모론을 제기하자 도미니언은 손해배상 청구소송을 제기했다. 뉴스위크는 지난 18일 보도에서 “이번 합의는 트럼프 대통령의 근거 없는 부정선거 주장에 대한 것”이라면서 “트럼프 대통령이 선거에서 패배한 후 그의 지지자 사이에서 음모론이 확산됐다. 하지만 이런 주장은 모두 입증되지 않았으며, 법원은 관련 소송 수십 건을 기각했다”고 밝혔다.관련기사트럼프 측근이 윤석열 부당 대우 우려? 가짜뉴스 논쟁이 남긴 것 “6·3 대선 조작” 워싱턴중앙일보 1면에 중앙일보 “법적 대응 검토” 세계선거기관협의회, ‘부정선거’ 스카이데일리 손해배상 소송 미국 관영언론, 트럼프 비판 SNS 글 쓴 언론인 직무정지 더보기 또 뉴스위크는 트럼프 대통령이 도미니언을 상대로 보복 조치를 했다고 비판했다. 뉴스위크에 따르면 트럼프 대통령은 올해 초 도미니언 관련 재판이 진행되자 도미니언 변호를 맡은 로펌에게 불이익을 주는 행정명령에 서명했다. 해당 로펌에 사건을 의뢰하는 의뢰인은 연방정부와 거래를 할 수 없도록 조치한 것이다. 연방법원은 이 행정명령이 위법하다며 취소 조치를 내렸다. 이번 합의로 2020년 대선 관련 부정선거 음모론 보도 관련 주요 손해배상 소송은 1건만 남게 됐다. 뉴스맥스는 전자투표 업체인 스마트매틱의 부정선거 연루설을 보도해 지난해 9월 4000만 달러(한화 약 556억1200만 원)를 배상했다. 보수성향 방송사인 폭스뉴스도 도미니언 부정선거 음모론을 제기해 2023년 7억8750만 달러(한화 약 1조948억 원)를 배상했다. 다만 스마트매틱이 폭스뉴스에 제기한 손해배상 소송은 재판을 앞두고 있다. 폭스뉴스는 스마트매틱이 수정헌법 1조에 보장된 표현의 자유를 저해하고 있다고 주장하고 있다."
뉴시스,'반도체 왕국' 노골화하는 美 트럼프…삼성·SK '불안',"트럼프 ""수입 반도체 관세, 200~300%""美 정부 인텔 지분 인수설도…불확실성↑   [워싱턴=AP/뉴시스]도널드 트럼프 미국 대통령이 13일(현지 시간) 미국 워싱턴DC 케네디센터에서 연설하고 있다. 2025.08.14. [서울=뉴시스]이현주 기자 = 도널드 트럼프 미국 대통령이 노골적으로 자국 반도체 산업 챙기기에 나서면서 삼성전자를 비롯한 한국 업체들이 전전긍긍하는 모습이다.  19일 업계에 따르면 트럼프 대통령은 최근 기자들과 만나 반도체 관세 관련 ""200~300%까지 적용할 것""이라고 밝혔다.   앞서 트럼프 대통령은 애플의 신규 대미투자 계획을 발표하며 수입 반도체에 '100% 관세'를 예고한 바 있지만 이보다 2~3배 높은 수준인 셈이다.   미국 정부는 수입 반도체 업체가 관세를 면제받기 위해서는 트럼프 대통령 임기 중 미국 내 공장을 건설해야 한다고 압박하고 있다.   하워드 러트닉 상무장관은 언론 인터뷰를 통해 ""(트럼프) 임기 내 미국에 생산시설을 건설하겠다고 약속하고, 이를 상무부에 신고하며, 감사원 감독 하에 실제 건설을 진행할 경우 관세 없이 칩을 수입할 수 있도록 하겠다는 것""이라고 설명했다.   이에 현재 텍사스주 테일러에 파운드리(반도체 위탁생산) 공장을 짓고 있는 삼성전자와 인디애나주 웨스트라피엣에 첨단 패키징 공장 건설을 앞두고 있는 SK하이닉스의 경우 관세가 면제될 가능성이 높다는 관측이 나오고 있지만 마냥 안심할 수만은 없다는 지적이다.   트럼프 대통령과 러트닉 장관 발언이 행정부 내부 조율을 세밀하게 거쳐 나온 것은 아닌 만큼 불확실성이 상존하기 때문이다.   특히 부진에 빠진 인텔에 대해 미국 정부의 지분 취득을 논의 중이라는 보도가 나오는 등 트럼프 행정부가 노골적으로 자국 반도체 기업 챙기기에 나서면서 삼성전자, SK하이닉스 등 국내 반도체 제조업체가 직격탄을 맞을 수 있다는 해석이다.   앞서 트럼프 대통령은 지난 11일 립부 탄 인텔 최고경영자(CEO)와 백악관에서 만나 지분 인수 문제 등을 논의한 것으로 알려졌다. 그간 미국 정부의 인텔 지원 가능성은 종종 언급되어 왔지만 반도체 지원법(칩스법) 기금 활용 등 구체적인 방안이 거론된 건 이번이 처음이다.  closeAdvertisements[custom_chain] korean_weather [webstory]-20250820-00:08arrow_forward_ios더보기CANCELNEXT VIDEOPausePlay% buffered00:0000:0000:56UnmuteMutePlayPowered by GliaStudio 미국 정부가 글로벌 반도체 산업에 직접적으로 개입하게 되면 삼성전자, SK하이닉스는 물론 전 세계 파운드리 1위 업체인 대만 TSMC 등도 부정적 영향을 피하기 어려울 전망이다.   류영호 NH투자증권 연구원은 보고서를 통해 ""최근 미국 산업에 중요한 기업에 정부가 개입하는 정황이 확인되고 있다""며 ""노골적인 미국의 자국기업 지원은 TSMC, 삼성전자와 같은 경쟁사 입장에서는 부정적""이라고 밝혔다.  단 경쟁사 대비 인텔의 기술 불확실성이 여전한 만큼 당장 현실화되진 않을 것이라는 관측도 나온다.   류 연구원은 ""아직 인텔의 18A 공정 개발의 불확실성이 높은 만큼 시간을 두고 지켜볼 필요가 있다""며 ""중요한 분기점은 하반기 18A(1.8나노) 공정의 성공적인 전환 여부가 될 것""이라고 예상했다.   ◎공감언론 뉴시스 lovelypsyche@newsis.com"
연합뉴스,"""푸틴, 트럼프에 '2주내 젤렌스키 만날 준비 돼있다' 말해""","(워싱턴=연합뉴스) 홍정규 특파원 = 블라디미르 푸틴 러시아 대통령이 도널드 트럼프 미국 대통령에게 볼로디미르 젤렌스키 우크라이나 대통령과 2주일 안에 만나겠다는 의사를 밝혔다고 프리드리히 메르츠 독일 총리가 18일(현지시간) 전했다.메르츠 총리는 이날 백악관 회담 이후 AFP 통신에 ""미국 대통령이 (전화로) 러시아 대통령과 얘기를 나눴고, 러시아 대통령과 우크라이나 대통령의 만남이 2주일 안에 이뤄질 것이라는 데 (양측이) 동의했다""고 AFP와 DPA 등 외신에 전했다.트럼프 대통령은 백악관에서 젤렌스키 대통령과 메르츠 총리 등 유럽 정상들과 단체 회동했으며, 비공개 회담 도중 푸틴 대통령과 전화 통화를 했다. 푸틴 대통령은 트럼프 대통령과의 통화에서 이같은 뜻을 밝혔다는 게 메르츠 총리의 전언이다.메르츠 총리는 푸틴 대통령과 젤렌스키 대통령의 회동 장소는 아직 정해지지 않았다면서 ""이번 만남이 휴전으로 이어지면 아주 바람직할 것""이라고 말했다.그는 다만 푸틴 대통령이 평화 협정의 조건으로 우크라이나에 돈바스 지역을 넘겨줄 것으로 요구하는 데 대해선 ""미국에 플로리다를 포기하라는 것""과 같다고 지적했다.트럼프 대통령은 푸틴 대통령과 젤렌스키 대통령의 양자 회담 이후 자신이 참여하는 3자 회담을 추진하겠다고 밝힌 상태다.zheng@yna.co.kr제보는 카카오톡 okjebo  <저작권자(c) 연합뉴스, 무단 전재-재배포, AI 학습 및 활용 금지>  2025/08/19 08:47 송고 2025년08월19일 08시47분 송고"
연합뉴스,2월 같은 '외교참사' 없었다…서로 예의 차린 트럼프-젤렌스키,"(워싱턴 런던=연합뉴스) 조준형 김지연 특파원 = 미국 워싱턴 DC 백악관에서 18일(현지시간) 열린 도널드 트럼프 미국 대통령과 볼로디미르 젤렌스키 우크라이나 대통령의 정상회담은 세기의 '외교참사'로 기록된 지난 2월의 회담과는 자못 다른 분위기에서 진행됐다.이날 미국-우크라이나 정상회담은 약 6개월 전의 회담과 같은 장소에서, 같은 인물 간에 이뤄진 것이었지만 별다른 '파격'이나 '충격 요소' 없이 '정상적인 정상회담'으로 치러졌다.앞서 두 정상은 지난 2월28일 백악관에서 열린 회담에서 우크라이나전쟁의 종전 추진 방향, 블라디미르 푸틴 러시아 대통령에 대한 인식 등을 놓고 첨예한 입장 차이를 드러낸 채 언쟁을 벌였다.주로 트럼프 대통령이 ""당신은 카드가 없다"", ""세계 3차 대전(이 일어날 가능성)을 도박하고 있다"", ""무례하다"" 등의 날 선 발언을 퍼부으며 젤렌스키 대통령을 몰아세웠고, 결국 젤렌스키 대통령은 예정된 백악관 오찬도 하지 못한 채 쫓겨나듯 귀국해야 했다.이날 그 당시와 달라진 분위기는 젤렌스키 대통령이 백악관 웨스트윙(서관) 정문 앞에 차량 편으로 도착했을 때부터 감지됐다.트럼프 대통령은 젤렌스키 대통령이 차에서 내리기 전 손을 들어 가볍게 인사했고, 차에서 내린 젤렌스키 대통령과 악수하면서 그의 어깨와 등을 연신 두드리며 친밀감을 과시했다.젤렌스키 대통령은 이날 칼라가 있는 셔츠와 재킷 등 군인들의 정복(正服) 느낌이 나는 정장 스타일의 검은색 옷을 입고 백악관에 나타났다.삼지창 문양이 새겨진 셔츠 차림으로 2월 백악관 회담에 나섰다가 트럼프 대통령으로부터 ""오늘 잘 차려입었네""라는 비아냥을 들었던 것과는 달랐다.2월 정상회담 때 젤렌스키 대통령에게 '왜 양복을 입지 않았느냐'는 질문을 했던, 우파 성향 방송 '리얼아메리카보이스'의 브라이언 글렌 기자는회담장인 백악관 집무실에서 젤렌스키 대통령을 향해 ""정장 차림이 멋지다""고 칭찬했고, 트럼프 대통령은 ""나도 똑같은 말을 했다""며 ""그(글렌 기자)가 지난번에 당신을 공격한 사람""이라고 말했다.이에 젤렌스키 대통령은 웃으면서 ""기억한다""고 말했고, 글렌 기자는 ""사과한다""고 말했다.젤렌스키 대통령은 기자를 향해 ""그런데 당신은 똑같은 정장을 입었다. 나는 바꿔 입었는데, 당신은 그대로""라고 농담까지 던지며 트럼프 대통령의 파안대소를 유도했다.회담 초반 젤렌스키 대통령은 부인인 올레나 젤렌스카 여사가 트럼프 대통령 부인인 멜라니아 여사에게 보내는 서한을 전달하며 '감성 외교'에 나섰다.젤렌스키 대통령이 ""이건 대통령님이 아니라 부인께 보내는 편지""라고 말하자 트럼프 대통령을 비롯한 현장에서는 웃음소리가 터져 나왔다.젤렌스키 대통령의 어조와 태도도 지난 2월 백악관 회담 때와 확연히 달랐다. 잔뜩 굳은 2월과 달리 그의 말투와 표정은 훨씬 더 여유로워졌고 발언 중 유머도 여러 차례 곁들였다.젤렌스키 대통령은 이날 멜라니아 여사가 우크라이나 전쟁 피해 아동을 염려하는 서한을 푸틴 러시아 대통령에게 보낸 데 대한 것을 포함해 트럼프 대통령을 향해 연신 ""감사하다""고 인사했다.지난 2월 회담 당시 트럼프 대통령과 밴스 부통령으로부터 ""감사할 줄 모른다""는 면박을 들은 뒤 일어난 변화로 보였다.영국 BBC 방송은 젤렌스키 대통령이 ""감사 인사를 흩뿌렸다""며 ""처음 단 몇 분 말하는 동안 트럼프와 미 정부에 '감사합니다'를 6번쯤 말했다""고 전했다.약 27분간 언론에 공개된 회담에서 트럼프 대통령은 발언 도중 몇차례 젤렌스키 대통령의 팔을 건드리거나, 그의 눈을 쳐다보며 말하는 등 친근감을 드러냈다.또한 트럼프 대통령은 우크라이나 지원에 대한 기자 질문에 자신의 발언을 한 뒤 젤렌스키 대통령에게 한마디 하라고 독려하는 '배려의 매너'도 보여줬다.젤렌스키 대통령을 무시하는 듯한 발언 태도나 고압적인 태도는 거의 보이지 않았다.또 2월 정상회담 때 정상간 대화 중간에 끼어들며 젤렌스키 대통령의 태도를 문제 삼아 '파국'의 단초를 제공했던 JD 밴스 미국 부통령은 이날 언론에 공개된 세션에서 시종 침묵을 지켰다.'사고'(事故)가 없었던 이날 회담에는 결국 두 사람이 2월 회담의 파국으로부터 배운 '교훈'이 작용한 것으로 풀이된다.또 지난 15일 미·러 정상회담에 이어 우크라이나 전쟁 종전을 위한 외교적 모색이 한창 진행 중인 상황도 양 정상의 조심스러운 대응의 배경으로 보였다.특히 트럼프 대통령으로선 사흘 전 푸틴 대통령에게 '양보'를 받아내지 못한 채 '레드카펫'을 깔아주며 외교적 고립 해소의 기회만 준 것 아니냐는 일각의 비판을 받는 상황에서 젤렌스키 대통령에게 예의를 갖추지 않을 경우 중재자로서의 신뢰성을 의심받을 수 있다는 점을 의식했을 수 있어 보인다.jhcho@yna.co.kr, cherora@yna.co.kr제보는 카카오톡 okjebo  <저작권자(c) 연합뉴스, 무단 전재-재배포, AI 학습 및 활용 금지>  2025/08/19 05:09 송고 2025년08월19일 05시09분 송고"
